{
  "artifact_type": "hint_vocabulary",
  "source": "illustrative rows; every identifier must be copied from the published authority file",
  "generic_ids": ["wikidata:Q11424"],
  "terms": [
    {
      "term_kind": "genre_form",
      "label": "Film noir",
      "aliases": ["Films noirs", "Film Noir"],
      "ids": {"lcgft": "gf2011026321", "gnd": "4154664-4"}
    },
    {
      "term_kind": "topical",
      "label": "Alienation (Social psychology)",
      "aliases": ["Entfremdung", "Aliénation (psychologie sociale)"],
      "ids": {"lcsh": "sh85003435", "gnd": "4014670-1", "rameau": "FRBNF11930652"},
      "related_ids": [{"scheme": "aat", "id": "300055520", "match": "related"}]
    },
    {
      "term_kind": "genre_form",
      "label": "Comedy films",
      "aliases": ["Komödie"],
      "ids": {"lcgft": "gf2011026147"},
      "generic": true
    }
  ]
}
